{
  "schemaVersion": "1.0",
  "assetId": "forzy-motor-01",
  "activeHistoricalBatchId": "sha256:215623e388951c5587bf655b5ce4d39ece4f6755623c534161d5859844682697",
  "requestedRange": { "from": null, "to": null },
  "effectiveRange": null,
  "materialization": {
    "state": "not_materialized",
    "assessmentCount": 0,
    "assessmentManifestSha256": null
  },
  "aggregationSummary": {
    "requestedMaxPoints": 1200,
    "originalAssessmentCount": 0,
    "returnedAssessmentCount": 0,
    "omittedAssessmentCount": 0,
    "reducedSeriesCount": 0
  },
  "series": []
}
